{"grao":"1 linha por período × grupo × departamento","dimensoes":{"periodo":["4s","13s","26s","base"],"grupo":["Fiéis","Regulares","Esporádicos","Em pausa","Sem segmento"],"departamento":["AUTOMOTIVE","CHEF SHOPPE","COSMETICS","DELI","DRUG GM","FLORAL","FROZEN GROCERY","GROCERY","MEAT","MEAT-PCKGD","NUTRITION","PASTRY","PHOTO","POSTAL CENTER","PRODUCE","RESTAURANT","RX","SALAD BAR","SEAFOOD","SEAFOOD-PCKGD","SPIRITS","TRAVEL & LEISUR","VIDEO","DELI/SNACK BAR","DAIRY DELI","GARDEN CENTER","TOYS","GM MERCH EXP","HBC","MEAT-WHSE","PORK","CHARITABLE CONT","ELECT &PLUMBING","GRO BAKERY","PROD-WHS SALES","VIDEO RENTAL","HOUSEWARES"]},"colunas":["periodo","grupo","departamento","faturamento","desconto","valor_bruto","faturamento_comparavel","desconto_comparavel","valor_bruto_comparavel","faturamento_ano_anterior","desconto_ano_anterior","valor_bruto_ano_anterior"],"linhas":[[0,0,0,8.47,0.0,8.47,8.47,0.0,8.47,3.5,0.0,3.5],[0,0,1,170.06,12.41,182.47,165.06,10.43,175.49,8.97,0.0,8.97],[0,0,2,1178.17,236.79,1414.96,1142.01,236.0,1378.01,964.41,156.72,1121.13],[0,0,3,8667.19,835.64,9502.83,7982.39,802.79,8785.18,7075.89,661.58,7737.47],[0,0,4,36815.03,4374.87,41189.9,34286.62,4089.96,38376.58,31498.56,2824.39,34322.95],[0,0,5,1936.72,61.87,1998.59,1840.85,61.87,1902.72,1460.31,19.85,1480.16],[0,0,6,44.63,0.0,44.63,30.0,0.0,30.0,27.24,0.0,27.24],[0,0,7,137482.6,26136.85,163619.45,130440.11,25022.96,155463.07,113010.14,21284.76,134294.9],[0,0,8,16275.84,4756.85,21032.69,15403.31,4501.29,19904.6,14588.21,4609.7,19197.91],[0,0,9,12850.42,3002.47,15852.89,12166.47,2848.81,15015.28,10594.17,2620.66,13214.83],[0,0,10,3978.18,523.16,4501.34,3681.1,505.2,4186.3,2823.19,225.85,3049.04],[0,0,11,3674.96,455.21,4130.17,3522.85,438.18,3961.03,2886.44,293.26,3179.7],[0,0,12,2.49,0.0,2.49,2.49,0.0,2.49,0.0,0.0,0.0],[0,0,13,2.31,0.0,2.31,2.31,0.0,2.31,0.0,0.0,0.0],[0,0,14,18414.79,1593.56,20008.35,17430.84,1515.16,18946.0,15157.18,2126.86,17284.04],[0,0,15,164.86,0.0,164.86,130.65,0.0,130.65,32.89,0.0,32.89],[0,0,16,26.88,0.0,26.88,20.89,0.0,20.89,0.0,0.0,0.0],[0,0,17,1073.88,0.0,1073.88,1006.22,0.0,1006.22,972.21,63.64,1035.85],[0,0,18,1318.16,223.35,1541.51,1145.33,209.59,1354.92,924.03,130.92,1054.95],[0,0,19,2493.69,764.62,3258.31,2362.37,730.06,3092.43,1786.71,526.54,2313.25],[0,0,20,697.51,0.0,697.51,697.51,0.0,697.51,698.22,0.0,698.22],[0,0,21,74.74,11.92,86.66,64.47,10.33,74.8,45.79,3.55,49.34],[0,0,22,21.98,0.0,21.98,21.98,0.0,21.98,0.0,0.0,0.0],[0,1,0,5.95,0.0,5.95,5.95,0.0,5.95,0.0,0.0,0.0],[0,1,1,45.36,1.99,47.35,45.36,1.99,47.35,2.99,0.0,2.99],[0,1,2,284.96,34.52,319.48,259.56,28.01,287.57,332.09,74.61,406.7],[0,1,3,3058.56,277.86,3336.42,2864.19,249.67,3113.86,2563.28,249.5,2812.78],[0,1,4,11964.97,1218.04,13183.01,10979.09,1037.36,12016.45,11717.03,1284.66,13001.69],[0,1,5,1065.77,76.48,1142.25,997.82,71.48,1069.3,663.99,0.0,663.99],[0,1,6,5.92,0.19,6.11,4.23,0.19,4.42,3.94,0.0,3.94],[0,1,7,54433.45,10354.85,64788.3,51077.24,9592.12,60669.36,48744.0,9904.84,58648.84],[0,1,8,6984.28,2094.97,9079.25,6607.05,1973.27,8580.32,6606.82,1903.15,8509.97],[0,1,9,5220.94,1315.78,6536.72,4960.4,1231.81,6192.21,5407.37,1470.07,6877.44],[0,1,10,1302.74,225.82,1528.56,1138.83,182.83,1321.66,1059.26,96.84,1156.1],[0,1,11,1613.9,195.76,1809.66,1519.5,180.72,1700.22,1578.46,160.13,1738.59],[0,1,13,1.65,0.0,1.65,1.65,0.0,1.65,0.0,0.0,0.0],[0,1,14,6334.6,588.95,6923.55,5930.36,537.34,6467.7,6374.49,853.19,7227.68],[0,1,15,28.31,0.0,28.31,28.31,0.0,28.31,9.51,0.0,9.51],[0,1,17,360.08,0.0,360.08,351.14,0.0,351.14,449.41,10.25,459.66],[0,1,18,368.47,87.33,455.8,306.88,73.33,380.21,246.74,37.33,284.07],[0,1,19,849.72,271.31,1121.03,803.22,259.94,1063.16,908.9,309.38,1218.28],[0,1,20,208.4,0.0,208.4,178.43,0.0,178.43,175.61,0.0,175.61],[0,1,21,34.91,3.54,38.45,34.91,3.54,38.45,16.39,3.36,19.75],[0,2,2,35.7,21.14,56.84,35.7,21.14,56.84,65.07,5.01,70.08],[0,2,3,278.09,39.88,317.97,238.54,34.84,273.38,387.34,30.92,418.26],[0,2,23,3.99,0.0,3.99,3.99,0.0,3.99,0.0,0.0,0.0],[0,2,4,1259.03,171.95,1430.98,1180.71,141.75,1322.46,2001.81,202.97,2204.78],[0,2,5,158.03,19.98,178.01,145.87,19.98,165.85,188.91,0.0,188.91],[0,2,7,4031.38,772.75,4804.13,3772.39,730.35,4502.74,7971.7,1611.04,9582.74],[0,2,8,474.17,146.91,621.08,438.77,131.62,570.39,1103.19,356.79,1459.98],[0,2,9,407.94,82.06,490.0,378.68,76.41,455.09,1045.38,278.53,1323.91],[0,2,10,79.38,10.7,90.08,69.42,10.7,80.12,83.44,17.28,100.72],[0,2,11,265.69,21.29,286.98,223.82,21.29,245.11,247.78,20.35,268.13],[0,2,13,0.33,0.0,0.33,0.33,0.0,0.33,0.0,0.0,0.0],[0,2,14,422.27,56.63,478.9,364.04,42.92,406.96,868.44,138.87,1007.31],[0,2,17,16.76,0.0,16.76,16.76,0.0,16.76,68.89,0.0,68.89],[0,2,18,34.44,3.28,37.72,34.44,3.28,37.72,35.75,7.2,42.95],[0,2,19,65.57,16.76,82.33,62.07,16.27,78.34,166.19,45.02,211.21],[0,2,20,33.97,0.0,33.97,33.97,0.0,33.97,64.64,0.0,64.64],[0,2,21,0.0,0.0,0.0,0.0,0.0,0.0,5.29,0.0,5.29],[0,3,2,0.0,0.0,0.0,0.0,0.0,0.0,47.17,0.0,47.17],[0,3,3,0.0,0.0,0.0,0.0,0.0,0.0,146.58,13.22,159.8],[0,3,4,0.0,0.0,0.0,0.0,0.0,0.0,1166.35,106.43,1272.78],[0,3,5,0.0,0.0,0.0,0.0,0.0,0.0,5.99,0.0,5.99],[0,3,7,0.0,0.0,0.0,0.0,0.0,0.0,3589.1,674.21,4263.31],[0,3,8,0.0,0.0,0.0,0.0,0.0,0.0,319.63,66.09,385.72],[0,3,9,0.0,0.0,0.0,0.0,0.0,0.0,332.96,84.62,417.58],[0,3,10,0.0,0.0,0.0,0.0,0.0,0.0,90.65,11.94,102.59],[0,3,11,0.0,0.0,0.0,0.0,0.0,0.0,82.75,21.46,104.21],[0,3,14,0.0,0.0,0.0,0.0,0.0,0.0,331.94,36.26,368.2],[0,3,17,0.0,0.0,0.0,0.0,0.0,0.0,37.78,0.0,37.78],[0,3,19,0.0,0.0,0.0,0.0,0.0,0.0,44.29,10.69,54.98],[0,3,20,0.0,0.0,0.0,0.0,0.0,0.0,48.96,0.0,48.96],[0,3,21,0.0,0.0,0.0,0.0,0.0,0.0,1.1,0.0,1.1],[0,4,3,0.0,0.0,0.0,0.0,0.0,0.0,76.84,4.88,81.72],[0,4,4,0.0,0.0,0.0,0.0,0.0,0.0,242.87,17.64,260.51],[0,4,5,0.0,0.0,0.0,0.0,0.0,0.0,24.96,0.0,24.96],[0,4,7,0.0,0.0,0.0,0.0,0.0,0.0,910.0,234.47,1144.47],[0,4,8,0.0,0.0,0.0,0.0,0.0,0.0,77.55,37.49,115.04],[0,4,9,0.0,0.0,0.0,0.0,0.0,0.0,37.76,16.07,53.83],[0,4,10,0.0,0.0,0.0,0.0,0.0,0.0,67.68,4.7,72.38],[0,4,11,0.0,0.0,0.0,0.0,0.0,0.0,33.25,1.19,34.44],[0,4,14,0.0,0.0,0.0,0.0,0.0,0.0,171.9,30.07,201.97],[0,4,18,0.0,0.0,0.0,0.0,0.0,0.0,10.97,6.28,17.25],[0,4,20,0.0,0.0,0.0,0.0,0.0,0.0,11.97,0.0,11.97],[1,0,0,10.72,0.0,10.72,10.72,0.0,10.72,22.62,0.0,22.62],[1,0,1,410.3,56.82,467.12,397.31,52.86,450.17,8.97,0.0,8.97],[1,0,2,4048.62,1253.09,5301.71,3859.05,1176.14,5035.19,3075.91,730.24,3806.15],[1,0,24,0.0,0.0,0.0,0.0,0.0,0.0,16.56,0.7,17.26],[1,0,3,27908.37,2440.09,30348.46,25597.66,2296.89,27894.55,22835.39,1775.56,24610.95],[1,0,23,2.99,0.0,2.99,2.99,0.0,2.99,0.0,0.0,0.0],[1,0,4,120075.91,15687.51,135763.42,112830.56,14570.85,127401.41,98460.33,10462.04,108922.37],[1,0,5,3893.35,93.99,3987.34,3753.58,93.99,3847.57,3352.21,66.18,3418.39],[1,0,6,124.49,3.45,127.94,102.95,2.52,105.47,72.09,0.0,72.09],[1,0,25,397.75,0.0,397.75,357.76,0.0,357.76,140.89,0.0,140.89],[1,0,7,438055.78,85315.1,523370.88,417406.43,81755.0,499161.43,360727.86,70380.55,431108.41],[1,0,8,53577.12,16275.39,69852.51,50847.86,15541.81,66389.67,45981.4,14935.03,60916.43],[1,0,9,41264.75,11365.32,52630.07,39442.29,10847.62,50289.91,34214.3,9034.88,43249.18],[1,0,10,12142.81,1618.46,13761.27,11335.28,1551.89,12887.17,8970.54,959.32,9929.86],[1,0,11,11319.27,1555.14,12874.41,10749.2,1495.87,12245.07,9619.08,1223.13,10842.21],[1,0,12,7.22,0.5,7.72,7.22,0.5,7.72,0.0,0.0,0.0],[1,0,13,11.26,0.0,11.26,2.31,0.0,2.31,0.0,0.0,0.0],[1,0,14,57359.1,5228.47,62587.57,54490.81,4981.63,59472.44,48330.21,4984.22,53314.43],[1,0,15,367.67,0.0,367.67,313.63,0.0,313.63,122.09,4.2,126.29],[1,0,16,47.77,0.0,47.77,41.78,0.0,41.78,17.98,0.0,17.98],[1,0,17,3305.86,55.39,3361.25,3049.52,31.88,3081.4,2313.49,123.88,2437.37],[1,0,18,3455.92,588.43,4044.35,3150.87,571.25,3722.12,2849.41,546.45,3395.86],[1,0,19,7337.95,2525.19,9863.14,7077.05,2433.89,9510.94,5908.28,1921.09,7829.37],[1,0,20,2521.72,0.0,2521.72,2471.47,0.0,2471.47,2386.01,0.0,2386.01],[1,0,26,0.0,0.0,0.0,0.0,0.0,0.0,1.49,0.0,1.49],[1,0,21,220.65,40.4,261.05,197.81,38.81,236.62,115.35,17.87,133.22],[1,0,22,21.98,0.0,21.98,21.98,0.0,21.98,0.0,0.0,0.0],[1,1,0,31.15,0.0,31.15,31.15,0.0,31.15,18.99,0.0,18.99],[1,1,1,112.68,11.42,124.1,112.68,11.42,124.1,2.99,0.0,2.99],[1,1,2,1067.1,310.66,1377.76,1013.4,288.33,1301.73,1241.14,268.13,1509.27],[1,1,24,0.0,0.0,0.0,0.0,0.0,0.0,20.38,1.12,21.5],[1,1,3,9938.7,843.4,10782.1,9374.99,789.52,10164.51,8595.38,630.6,9225.98],[1,1,4,38045.4,4869.83,42915.23,35776.03,4552.49,40328.52,36799.49,4429.34,41228.83],[1,1,5,1710.06,93.02,1803.08,1609.12,88.02,1697.14,1716.73,14.98,1731.71],[1,1,6,41.17,2.44,43.61,36.19,2.44,38.63,11.81,0.0,11.81],[1,1,25,9.99,0.0,9.99,9.99,0.0,9.99,0.0,0.0,0.0],[1,1,7,164700.73,32643.95,197344.68,156760.49,30968.67,187729.16,158156.38,32255.48,190411.86],[1,1,8,21906.64,6694.94,28601.58,20903.72,6335.04,27238.76,22426.38,7050.2,29476.58],[1,1,9,15873.7,4579.85,20453.55,15287.17,4419.79,19706.96,16910.26,4829.45,21739.71],[1,1,10,3337.29,575.96,3913.25,3013.5,509.92,3523.42,3210.67,410.02,3620.69],[1,1,11,4949.75,707.97,5657.72,4704.5,680.16,5384.66,5058.36,582.75,5641.11],[1,1,13,1.65,0.0,1.65,1.65,0.0,1.65,0.0,0.0,0.0],[1,1,14,20089.98,1811.83,21901.81,18897.35,1703.87,20601.22,19291.82,2013.87,21305.69],[1,1,15,105.98,0.0,105.98,105.18,0.0,105.18,62.47,0.0,62.47],[1,1,16,22.08,0.0,22.08,22.08,0.0,22.08,0.0,0.0,0.0],[1,1,17,1173.92,2.34,1176.26,1153.97,2.34,1156.31,1274.69,29.35,1304.04],[1,1,18,1048.51,297.0,1345.51,960.07,279.0,1239.07,788.77,195.23,984.0],[1,1,19,3026.92,1200.07,4226.99,2873.63,1139.54,4013.17,2911.37,1074.95,3986.32],[1,1,20,717.38,0.0,717.38,669.93,0.0,669.93,650.52,0.0,650.52],[1,1,21,105.29,28.49,133.78,102.82,27.7,130.52,60.08,10.58,70.66],[1,2,0,0.0,0.0,0.0,0.0,0.0,0.0,10.78,0.0,10.78],[1,2,1,13.96,0.0,13.96,10.97,0.0,10.97,0.0,0.0,0.0],[1,2,2,122.21,55.27,177.48,111.64,48.68,160.32,183.36,20.94,204.3],[1,2,24,0.0,0.0,0.0,0.0,0.0,0.0,2.88,0.25,3.13],[1,2,3,950.73,99.97,1050.7,837.08,89.85,926.93,1330.21,104.06,1434.27],[1,2,23,3.99,0.0,3.99,3.99,0.0,3.99,0.0,0.0,0.0],[1,2,4,4990